{
  "schema_version": "4.0",
  "source_schema_version": "3.0",
  "generated_at": "2026-10-15T05:24:09.635634+00:00",
  "rules_version": "1.0",
  "quality_score": 1.0,
  "quality_gate": "PASS",
  "components": {
    "completeness": 1.0,
    "freshness": 1.0,
    "validity": 1.0,
    "consistency": 1.0
  },
  "counts": {
    "expected": 5,
    "available": 5,
    "fresh": 5,
    "valid": 5,
    "consistent": 5
  },
  "degradation_reasons": [
    "FALLBACK_SOURCE_USED"
  ],
  "metrics": [
    {
      "metric_id": "US10Y",
      "available": true,
      "freshness": {
        "is_fresh": true,
        "age_hours": 24.4027,
        "threshold_hours": 36.0
      },
      "validity": {
        "is_valid": true
      },
      "consistency": {
        "is_consistent": true
      },
      "source_evidence": {
        "source": "Yahoo Finance via yfinance",
        "source_type": "FALLBACK",
        "upstream_status": "FRESH",
        "upstream_error": "Primary FRED failed; fallback used: 'DATE'"
      },
      "reasons": [
        "FALLBACK_SOURCE_USED"
      ]
    },
    {
      "metric_id": "DXY",
      "available": true,
      "freshness": {
        "is_fresh": true,
        "age_hours": 1.4027,
        "threshold_hours": 36.0
      },
      "validity": {
        "is_valid": true
      },
      "consistency": {
        "is_consistent": true
      },
      "source_evidence": {
        "source": "Yahoo Finance via yfinance",
        "source_type": "PRIMARY",
        "upstream_status": "FRESH",
        "upstream_error": null
      },
      "reasons": []
    },
    {
      "metric_id": "VIX",
      "available": true,
      "freshness": {
        "is_fresh": true,
        "age_hours": 24.4027,
        "threshold_hours": 36.0
      },
      "validity": {
        "is_valid": true
      },
      "consistency": {
        "is_consistent": true
      },
      "source_evidence": {
        "source": "Yahoo Finance via yfinance",
        "source_type": "PRIMARY",
        "upstream_status": "FRESH",
        "upstream_error": null
      },
      "reasons": []
    },
    {
      "metric_id": "BTC",
      "available": true,
      "freshness": {
        "is_fresh": true,
        "age_hours": 0.0221,
        "threshold_hours": 2.0
      },
      "validity": {
        "is_valid": true
      },
      "consistency": {
        "is_consistent": true
      },
      "source_evidence": {
        "source": "CoinGecko Public API",
        "source_type": "PRIMARY",
        "upstream_status": "FRESH",
        "upstream_error": null
      },
      "reasons": []
    },
    {
      "metric_id": "ETH",
      "available": true,
      "freshness": {
        "is_fresh": true,
        "age_hours": 0.0277,
        "threshold_hours": 2.0
      },
      "validity": {
        "is_valid": true
      },
      "consistency": {
        "is_consistent": true
      },
      "source_evidence": {
        "source": "CoinGecko Public API",
        "source_type": "PRIMARY",
        "upstream_status": "FRESH",
        "upstream_error": null
      },
      "reasons": []
    }
  ]
}